{
  "artifacts": {
    "plan": {
      "media_type": "text/markdown",
      "path": "plan.md"
    },
    "spec": {
      "media_type": "text/markdown",
      "path": "spec.md"
    }
  },
  "created_at": "2026-10-08T01:50:46Z",
  "created_by": "human:owner",
  "extensions": {},
  "nodes": [
    {
      "artifact_refs": [
        {
          "artifact": "spec",
          "section": "Goal"
        }
      ],
      "body": {
        "text": "Context is selected, never dumped: slices load within budget, spawn as subagent briefs, verify by digest. Owner directive 2026-10-08."
      },
      "created_at": "2026-10-08T01:50:46Z",
      "created_by": "human:owner",
      "epistemic_state": "DECLARED",
      "extensions": {},
      "kind": "GOAL",
      "node_id": "goal-codify",
      "provenance_refs": [],
      "revision": 1,
      "title": "Codify Spec/Design/Tasks/Review as schema-backed, budget-bounded, traversable structure"
    },
    {
      "artifact_refs": [
        {
          "artifact": "plan",
          "section": "Tasks"
        }
      ],
      "body": {
        "text": "Structured_Brief + Technical_Spec (context algorithm, readiness, change impact, effect ledger), Lean_Control_Plane_Review (8-op contract), okf read --depth implementation, the three digested papers, loom L0 code. Primary sources first."
      },
      "created_at": "2026-10-08T01:50:47Z",
      "created_by": "human:owner",
      "epistemic_state": "DECLARED",
      "extensions": {},
      "kind": "TASK",
      "node_id": "p1-archaeology",
      "provenance_refs": [],
      "revision": 1,
      "title": "Phase 1: in-repo archaeology"
    },
    {
      "artifact_refs": [
        {
          "artifact": "plan",
          "section": "Tasks"
        }
      ],
      "body": {
        "text": "Graph-based context selection (GraphRAG lineage), repo-map techniques (aider), surface context strategies, MCP structured feeds, spec slicing / program dependence graphs, JSON graph practice (JSON-LD framing, hypermedia) for the doubly-linked index question."
      },
      "created_at": "2026-10-08T01:50:47Z",
      "created_by": "human:owner",
      "epistemic_state": "DECLARED",
      "extensions": {},
      "kind": "TASK",
      "node_id": "p2-external",
      "provenance_refs": [],
      "revision": 1,
      "title": "Phase 2: external scan 2024-2026 (bounded)"
    },
    {
      "artifact_refs": [
        {
          "artifact": "plan",
          "section": "Tasks"
        }
      ],
      "body": {
        "text": "Frozen mapping table (artifact->defs->runtime, every cell cited), file strategy decision, selection algorithm spec (determinism, budget, omissions, complexity), subagent brief format round-tripping all three surfaces."
      },
      "created_at": "2026-10-08T01:50:47Z",
      "created_by": "human:owner",
      "epistemic_state": "DECLARED",
      "extensions": {},
      "kind": "TASK",
      "node_id": "p3-synthesis",
      "provenance_refs": [],
      "revision": 1,
      "title": "Phase 3: synthesis"
    },
    {
      "artifact_refs": [
        {
          "artifact": "plan",
          "section": "Tasks"
        }
      ],
      "body": {
        "text": "Design doc + task DAG feeding loom L1/L2. No loader/selector code before this gate."
      },
      "created_at": "2026-10-08T01:50:47Z",
      "created_by": "human:owner",
      "epistemic_state": "DECLARED",
      "extensions": {},
      "kind": "TASK",
      "node_id": "p4-gate",
      "provenance_refs": [],
      "revision": 1,
      "title": "Phase 4: decision + plan gate"
    },
    {
      "artifact_refs": [
        {
          "artifact": "plan",
          "section": "Tasks"
        }
      ],
      "body": {
        "text": "Direct iteration with the owner produced the codified format: specpack.schema.json 0.2 + example-add-todo.specpack.json + rendered HTML + proposal. Alignment rules A1-A6 proven by execution; schema validates the example with 0 errors."
      },
      "created_at": "2026-10-08T02:37:49Z",
      "created_by": "human:owner",
      "epistemic_state": "DECLARED",
      "extensions": {},
      "kind": "TASK",
      "node_id": "synthesis-specpack",
      "provenance_refs": [],
      "revision": 1,
      "title": "Synthesis: specpack 0.2 \u2014 schema, example, rendered reference"
    }
  ],
  "profile": "pi",
  "relations": [
    {
      "created_at": "2026-10-08T01:50:47Z",
      "created_by": "human:owner",
      "epistemic_state": "DECLARED",
      "extensions": {},
      "from_ref": {
        "node_id": "p3-synthesis",
        "revision": 1
      },
      "kind": "requires",
      "relation_id": "rel-p3-synthesis-req-0-p1-archaeology",
      "revision": 1,
      "to_ref": {
        "node_id": "p1-archaeology",
        "revision": 1
      }
    },
    {
      "created_at": "2026-10-08T01:50:47Z",
      "created_by": "human:owner",
      "epistemic_state": "DECLARED",
      "extensions": {},
      "from_ref": {
        "node_id": "p3-synthesis",
        "revision": 1
      },
      "kind": "requires",
      "relation_id": "rel-p3-synthesis-req-1-p2-external",
      "revision": 1,
      "to_ref": {
        "node_id": "p2-external",
        "revision": 1
      }
    },
    {
      "created_at": "2026-10-08T01:50:47Z",
      "created_by": "human:owner",
      "epistemic_state": "DECLARED",
      "extensions": {},
      "from_ref": {
        "node_id": "p4-gate",
        "revision": 1
      },
      "kind": "requires",
      "relation_id": "rel-p4-gate-req-0-p3-synthesis",
      "revision": 1,
      "to_ref": {
        "node_id": "p3-synthesis",
        "revision": 1
      }
    }
  ],
  "revision": 13,
  "runtime": {
    "attempts": [
      {
        "attempt_id": "att-synthesis-specpack-1",
        "commands": [
          {
            "command": "uv run --with jsonschema python: validate specpack example against schema",
            "evidence_level": "attested",
            "exit_code": 0
          }
        ],
        "finished_at": "2026-10-08T02:37:59Z",
        "notes": "owner-approved ('love it'); defaults in force; ratification via golden-path-f57902a6",
        "result": "pass",
        "started_at": "2026-10-08T02:37:59Z",
        "task_id": "synthesis-specpack",
        "worker": "agent:pi"
      }
    ],
    "events": [
      {
        "at": "2026-10-08T01:50:46Z",
        "detail": "GOAL goal-codify",
        "kind": "node.added"
      },
      {
        "at": "2026-10-08T01:50:47Z",
        "detail": "TASK p1-archaeology",
        "kind": "node.added"
      },
      {
        "at": "2026-10-08T01:50:47Z",
        "detail": "TASK p2-external",
        "kind": "node.added"
      },
      {
        "at": "2026-10-08T01:50:47Z",
        "detail": "TASK p3-synthesis",
        "kind": "node.added"
      },
      {
        "at": "2026-10-08T01:50:47Z",
        "detail": "TASK p4-gate",
        "kind": "node.added"
      },
      {
        "at": "2026-10-08T02:37:49Z",
        "detail": "p1-archaeology",
        "kind": "task.cancelled"
      },
      {
        "at": "2026-10-08T02:37:49Z",
        "detail": "p2-external",
        "kind": "task.cancelled"
      },
      {
        "at": "2026-10-08T02:37:49Z",
        "detail": "p4-gate",
        "kind": "task.cancelled"
      },
      {
        "at": "2026-10-08T02:37:49Z",
        "detail": "TASK synthesis-specpack",
        "kind": "node.added"
      },
      {
        "at": "2026-10-08T02:37:58Z",
        "detail": "1",
        "kind": "tasks.promoted"
      },
      {
        "at": "2026-10-08T02:37:58Z",
        "detail": "synthesis-specpack ctx=94c1be3ae00c",
        "kind": "task.running"
      },
      {
        "at": "2026-10-08T02:37:59Z",
        "detail": "synthesis-specpack pass (1 command(s))",
        "kind": "task.recorded"
      },
      {
        "at": "2026-10-08T02:38:11Z",
        "detail": "p3-synthesis",
        "kind": "task.cancelled"
      }
    ],
    "task_states": [
      {
        "attempts": [],
        "extensions": {},
        "state": "CANCELLED",
        "state_version": 2,
        "task_id": "p1-archaeology"
      },
      {
        "attempts": [],
        "extensions": {},
        "state": "CANCELLED",
        "state_version": 2,
        "task_id": "p2-external"
      },
      {
        "attempts": [],
        "extensions": {},
        "state": "CANCELLED",
        "state_version": 2,
        "task_id": "p3-synthesis"
      },
      {
        "attempts": [],
        "extensions": {},
        "state": "CANCELLED",
        "state_version": 2,
        "task_id": "p4-gate"
      },
      {
        "attempts": [
          "att-synthesis-specpack-1"
        ],
        "context": {
          "context_id": "94c1be3ae00c",
          "digest": "30be8c670b95457bb3fb8938c3198e53519320f554f12cdeabdee9d2a271316a"
        },
        "extensions": {},
        "state": "SUCCEEDED",
        "state_version": 4,
        "task_id": "synthesis-specpack"
      }
    ]
  },
  "schema_version": "0.1.0",
  "spine_id": "spec-graph-research"
}
